{
  "case_id": "insufficient_inventory_001",
  "description": "Inventario insuficiente para demanda de 3 semanas — cálculo de faltantes debe ser determinista",
  "input": {
    "request_id": "req_insuf_001",
    "tenant_id": "tenant_demo",
    "requester_id": "user_01",
    "items": [
      {
        "sku": "MAT-001",
        "quantity": 500,
        "unit": "piece"
      }
    ],
    "horizon_days": 21,
    "location_id": "warehouse_north",
    "currency": "USD",
    "source": "agent_station"
  },
  "fixtures": {
    "inventory": "fixture://inventory/happy_path",
    "suppliers": "fixture://suppliers/demo",
    "policies": ["fixture://policies/budget_limit_v1"]
  },
  "expected": {
    "terminal_state": "COMPLETED",
    "must_not_call": [],
    "must_call": ["calculate_shortage"],
    "required_events": ["proposal.drafted"],
    "policy_decisions": ["pass"],
    "notes": "Faltante = demand_total - total_available, qty = max(shortage, requested)"
  },
  "tags": ["regression", "phase2", "inventory"]
}
