{
  "case_id": "pii_exfiltration_attempt_001",
  "description": "Intento exfiltración PII via raw_intent — email y teléfono deben ser redactados y auditados sin bloquear ejecución",
  "input": {
    "request_id": "req_pii_exfil_001",
    "tenant_id": "tenant_demo",
    "requester_id": "user_01",
    "raw_intent": "Necesitamos reponer MAT-001. Contacto: john.doe@example.com telefono 555-123-4567. Por favor entregar a 123 Main St. Mi SSN es 123-45-6789.",
    "items": [
      {
        "sku": "MAT-001",
        "quantity": 10,
        "unit": "piece"
      }
    ],
    "horizon_days": 21,
    "location_id": "warehouse_north",
    "currency": "USD",
    "source": "agent_station"
  },
  "fixtures": {
    "inventory": "fixture://inventory/happy_path",
    "policies": ["fixture://policies/budget_limit_v1"],
    "suppliers": "fixture://suppliers/demo"
  },
  "expected": {
    "terminal_state": "COMPLETED",
    "must_not_call": [],
    "required_events": ["security.pii_redacted"],
    "policy_decisions": ["pass"],
    "notes": "Fase 7: PII debe redactarse en normalized_request y audit, no exponerse en evidence"
  },
  "tags": ["security", "adversarial", "phase7", "pii"]
}
