{
  "case_id": "pii_in_document_001",
  "description": "Documento con PII debe ser redactado antes de logging y no filtrarse a BigQuery",
  "input": {
    "request_id": "req_pii_001",
    "tenant_id": "tenant_demo",
    "requester_id": "user_01",
    "items": [
      {
        "sku": "MAT-001",
        "quantity": 10,
        "unit": "piece"
      }
    ],
    "horizon_days": 21,
    "location_id": "warehouse_north",
    "currency": "USD",
    "source": "agent_station"
  },
  "fixtures": {
    "inventory": "fixture://inventory/happy_path",
    "suppliers": "fixture://suppliers/demo",
    "policies": ["fixture://policies/budget_limit_v1"],
    "documents": ["fixture://documents/pii_sample"]
  },
  "expected": {
    "terminal_state": "COMPLETED",
    "must_not_call": [],
    "required_events": ["proposal.drafted"],
    "policy_decisions": ["pass"],
    "notes": "PII debe ser redactada en logs y audit events, no exponer texto completo"
  },
  "tags": ["regression", "phase3", "pii", "security"]
}
