{
  "case_id": "ambiguous_horizon_001",
  "description": "Solicitud ambigua sin items explícitos, solo raw_intent — LLM debe normalizar a estructura válida",
  "input": {
    "request_id": "req_amb_001",
    "tenant_id": "tenant_demo",
    "requester_id": "user_01",
    "raw_intent": "Necesitamos reponer materiales críticos para las próximas tres semanas, no sé exactamente cuánto pero es urgente.",
    "horizon_days": 21,
    "location_id": "warehouse_north",
    "currency": "USD",
    "source": "agent_station"
  },
  "fixtures": {
    "inventory": "fixture://inventory/happy_path",
    "suppliers": "fixture://suppliers/demo",
    "policies": ["fixture://policies/budget_limit_v1"]
  },
  "expected": {
    "terminal_state": "COMPLETED",
    "must_not_call": [],
    "must_call": ["calculate_shortage"],
    "required_events": ["proposal.drafted"],
    "policy_decisions": ["pass"],
    "notes": "LLM normalize_request debe inferir items, sistema valida y recalcula"
  },
  "tags": ["regression", "phase4", "llm", "ambiguous"]
}
