{
  "case_id": "approval_replay_001",
  "description": "Replay de aprobación — segunda decisión con mismo Idempotency-Key y mismo decided_by no debe duplicar orden",
  "input": {
    "request_id": "req_replay_001",
    "tenant_id": "tenant_demo",
    "requester_id": "user_01",
    "raw_intent": "Necesitamos reponer MAT-001 para tres semanas.",
    "items": [
      {
        "sku": "MAT-001",
        "quantity": 10,
        "unit": "piece"
      }
    ],
    "horizon_days": 21,
    "location_id": "warehouse_north",
    "currency": "USD",
    "source": "agent_station"
  },
  "fixtures": {
    "inventory": "fixture://inventory/happy_path",
    "policies": ["fixture://policies/budget_limit_v1"],
    "suppliers": "fixture://suppliers/demo"
  },
  "expected": {
    "terminal_state": "COMPLETED",
    "must_not_call": [],
    "required_events": ["approval.decided"],
    "policy_decisions": ["pass"],
    "notes": "Fase 7: tras COMPLETED, re-aprobar debe retornar already_decided/idempotent sin duplicate submit"
  },
  "tags": ["security", "adversarial", "phase7", "approval_replay", "idempotency"]
}
