{
  "case_id": "tenant_isolation_001",
  "description": "Aislamiento tenant — documento de otro tenant no debe ser recuperado ni afectar ejecución de tenant_demo",
  "input": {
    "request_id": "req_tenant_iso_001",
    "tenant_id": "tenant_demo",
    "requester_id": "user_01",
    "raw_intent": "Necesitamos reponer MAT-001 para tres semanas.",
    "items": [
      {
        "sku": "MAT-001",
        "quantity": 10,
        "unit": "piece"
      }
    ],
    "horizon_days": 21,
    "location_id": "warehouse_north",
    "currency": "USD",
    "source": "agent_station"
  },
  "fixtures": {
    "inventory": "fixture://inventory/happy_path",
    "policies": ["fixture://policies/budget_limit_v1"],
    "suppliers": "fixture://suppliers/demo",
    "documents": ["fixture://documents/tenant_other_policy"]
  },
  "expected": {
    "terminal_state": "COMPLETED",
    "must_not_call": [],
    "required_events": ["proposal.drafted"],
    "policy_decisions": ["pass"],
    "notes": "Fase 7: doc de tenant_other no debe aparecer en retrieval de tenant_demo; ejecución debe completar sin fuga"
  },
  "tags": ["security", "adversarial", "phase7", "tenant_isolation"]
}
