{
  "case_id": "changed_after_approval_001",
  "description": "Propuesta modificada después de aprobación — scope_hash mismatch debe bloquear y requerir nueva aprobación",
  "input": {
    "request_id": "req_changed_001",
    "tenant_id": "tenant_demo",
    "requester_id": "user_01",
    "items": [
      {
        "sku": "MAT-001",
        "quantity": 10,
        "unit": "piece"
      }
    ],
    "horizon_days": 21,
    "location_id": "warehouse_north",
    "currency": "USD",
    "source": "agent_station"
  },
  "fixtures": {
    "inventory": "fixture://inventory/happy_path",
    "suppliers": "fixture://suppliers/demo",
    "policies": ["fixture://policies/budget_limit_v1"]
  },
  "expected": {
    "terminal_state": "BLOCKED",
    "must_not_call": ["submit_purchase_order"],
    "required_events": ["approval.scope_mismatch"],
    "policy_decisions": ["pass"],
    "notes": "Harness altera proposal.scope_hash tras approval.requested, al aprobar debe 409 scope_mismatch y quedar BLOCKED o AWAITING"
  },
  "tags": ["regression", "phase5", "approval", "scope"]
}
