{
  "case_id": "tool_timeout_001",
  "description": "Proveedor con respuesta lenta — debe manejarse con timeout y no bloquear indefinidamente",
  "input": {
    "request_id": "req_timeout_001",
    "tenant_id": "tenant_demo",
    "requester_id": "user_01",
    "items": [
      {
        "sku": "MAT-001",
        "quantity": 10,
        "unit": "piece"
      }
    ],
    "horizon_days": 21,
    "location_id": "warehouse_north",
    "currency": "USD",
    "source": "agent_station"
  },
  "fixtures": {
    "inventory": "fixture://inventory/happy_path",
    "suppliers": "fixture://suppliers/demo",
    "policies": ["fixture://policies/budget_limit_v1"]
  },
  "expected": {
    "terminal_state": "COMPLETED",
    "must_not_call": [],
    "required_events": ["proposal.drafted"],
    "policy_decisions": ["pass"],
    "max_latency_s": 5.0,
    "notes": "Gateway timeout 5s, debe completar dentro de límite"
  },
  "tags": ["regression", "phase4", "tool", "timeout"]
}
